{
  "schema": "sley.doctor.report.v0",
  "status": "ready",
  "target": "examples/project",
  "entry_module": "app.main",
  "summary": {
    "error_count": 0,
    "warning_count": 0,
    "module_count": 2,
    "task_count": 2,
    "call_count": 1,
    "lint_finding_count": 0
  },
  "diagnostics": [],
  "query": {
    "source_schema": "sley.query.report.v0",
    "kind": "all",
    "module_count": 2,
    "task_count": 2,
    "call_count": 1,
    "entrypoints": [
      "app.main.main",
      "app.math.double"
    ],
    "effectful_tasks": []
  },
  "lint": {
    "source_schema": "sley.lint.report.v0",
    "status": "ok",
    "rules": [
      "unused_private_task",
      "unreachable_private_task",
      "unused_declared_effect",
      "unused_import",
      "unused_take",
      "unused_private_type",
      "unused_private_effect",
      "raw_host_adapter",
      "missing_module_declaration",
      "unchecked_result",
      "unqualified_imported_call",
      "unused_pure_binding",
      "unused_pure_expression_statement",
      "mutable_binding_never_set",
      "constant_if_expression",
      "constant_if_statement",
      "constant_false_while_statement",
      "constant_comparison_expression",
      "constant_arithmetic_expression",
      "constant_text_concatenation_expression",
      "constant_list_index_expression",
      "constant_map_index_expression",
      "empty_if_statement",
      "empty_for_statement",
      "empty_forge_statement",
      "identity_binary_expression",
      "redundant_boolean_comparison",
      "absorbing_boolean_expression",
      "self_comparison_expression",
      "double_negation_expression",
      "negated_comparison_expression",
      "redundant_boolean_if_expression",
      "redundant_boolean_if_statement",
      "same_branch_if_expression",
      "same_branch_if_statement",
      "unreachable_statement"
    ],
    "finding_count": 0
  },
  "next_actions": [
    {
      "kind": "inspect_tasks",
      "reason": "query task facts before planning edits",
      "command": [
        "sley",
        "query",
        "--json",
        "--kind",
        "tasks",
        "examples/project"
      ]
    },
    {
      "kind": "inspect_calls",
      "reason": "strict call rows show caller/callee edges before rename, arity, or authority edits",
      "command": [
        "sley",
        "query",
        "--json",
        "--kind",
        "calls",
        "examples/project"
      ]
    },
    {
      "kind": "lint_gate",
      "reason": "preserve the warning-grade lint gate after edits",
      "command": [
        "sley",
        "lint",
        "--json",
        "--deny-warnings",
        "examples/project"
      ]
    },
    {
      "kind": "run_entrypoint",
      "reason": "main is pure and can run without runtime gates",
      "command": [
        "sley",
        "run",
        "--json",
        "examples/project"
      ]
    }
  ]
}
